{
  "$schema": "https://json-schema.org/draft/2020-12/schema",
  "$id": "VERA_AGI_HELD_OUT_SUITE_REGISTRY_V1",
  "title": "Vera AGI Held-Out Suite Registry V1",
  "type": "object",
  "additionalProperties": false,
  "required": [
    "schema",
    "subject_contract",
    "suites",
    "global_rules"
  ],
  "properties": {
    "schema": {
      "const": "VERA_AGI_HELD_OUT_SUITE_REGISTRY_V1"
    },
    "subject_contract": {
      "const": "VERA_MONO_AGI_RESEARCH_QUALIFICATION_V1"
    },
    "suites": {
      "type": "array",
      "minItems": 5,
      "items": {
        "type": "object",
        "additionalProperties": false,
        "required": [
          "id",
          "dimension_targets",
          "hidden_until_run",
          "required_controls",
          "pass_metrics"
        ],
        "properties": {
          "id": {
            "enum": [
              "NOVEL_MAPPING",
              "COMPOSITIONAL_TRANSFER",
              "REGIME_RETURN",
              "AMBIGUOUS_SPEC",
              "CORRECTION_TRANSFER",
              "EXTERNAL_ENVIRONMENT"
            ]
          },
          "dimension_targets": {
            "type": "array",
            "minItems": 1,
            "items": {
              "type": "string"
            }
          },
          "hidden_until_run": {
            "const": true
          },
          "required_controls": {
            "type": "array",
            "minItems": 1,
            "items": {
              "type": "string"
            }
          },
          "pass_metrics": {
            "type": "array",
            "minItems": 1,
            "items": {
              "type": "string"
            }
          }
        }
      }
    },
    "global_rules": {
      "type": "array",
      "minItems": 1,
      "items": {
        "type": "string"
      }
    }
  }
}
